Domain,Capability,Assessment,Criteria1,Criteria2
Security,Information Security Management,"Control network entry and exit points, reclaim permissions, force pcs to join the network domain and install anti-virus, and ensure the effective implementation of the system through internal and external audits the bank’s information security plan and information security specifications have been extended to all domestic and overseas units. In compliance with the requirements of the competent authorities to strengthen the supervision of information security management of overseas branches, we conduct annual computer system information security assessments and overall information security implementation assessments, and review network security. Compliance work and information security self-assessment.","Enterprise-wide Program Extension: Ensuring the information security program's reach and effectiveness across all organizational areas, including remote and cloud environments. Hybrid IT Ecosystem Security: Specific measures to address the security challenges of a hybrid IT ecosystem, including cloud security, endpoint protection, and identity management. Coverage of IT Environment Components: Strategies to ensure all components of the IT environment are covered by the information security program, including legacy systems, cloud services, and mobile devices./The information security program extends to the entire enterprise, addressing the hybrid IT ecosystem. This ensures that security practices and policies are uniformly applied across all IT environments, enhancing overall security posture./","Enterprise-wide Program Extension: Ensuring the information security program's reach and effectiveness across all organizational areas, including remote and cloud environments. Hybrid IT Ecosystem Security: Specific measures to address the security challenges of a hybrid IT ecosystem, including cloud security, endpoint protection, and identity management. Coverage of IT Environment Components: Strategies to ensure all components of the IT environment are covered by the information security program, including legacy systems, cloud services, and mobile devices./The information security program extends to the entire enterprise, addressing the hybrid IT ecosystem. This ensures that security practices and policies are uniformly applied across all IT environments, enhancing overall security posture./"
Security,Privacy,The bank has a dedicated department for personal information (legal compliance department),"Chief Privacy Officer Leadership: The role and impact of the chief privacy officer in defining, implementing, and enforcing the privacy program. Communication and Training Emphasis: Approaches to privacy training and awareness across the organization, including methods, frequency, and engagement metrics. Enterprise-scale Privacy Management: Key processes and procedures that support privacy management at an enterprise scale, highlighting compliance, data protection, and incident response strategies./Led by a chief privacy officer, the organization emphasizes enterprise-wide communication and training. Proven and documented processes and procedures enable privacy management at an enterprise scale./","Chief Privacy Officer Leadership: The role and impact of the chief privacy officer in defining, implementing, and enforcing the privacy program. Communication and Training Emphasis: Approaches to privacy training and awareness across the organization, including methods, frequency, and engagement metrics. Enterprise-scale Privacy Management: Key processes and procedures that support privacy management at an enterprise scale, highlighting compliance, data protection, and incident response strategies./Led by a chief privacy officer, the organization emphasizes enterprise-wide communication and training. Proven and documented processes and procedures enable privacy management at an enterprise scale./"
Security,GRC Risk Management,"Regularly conduct evidence preservation drills and notification drills for information security incidents to ensure that we can deal with them calmly when incidents occur. Ensure uninterrupted operations strengthen the ability to operate without interruption through the introduction of is22301strengthen the ability to operate without interruption through the introduction of iso22301the bank conducts cybersecurity information governance maturity assessment and iso27001 risk assessment. Disaster recovery and incident management are included in the maturity assessment areas, and related internal and external issues are also included in the iso27001 risk assessment.","Integration with Critical Functions: How cybersecurity risk management is integrated with disaster recovery, incident management, and other critical functions to enhance overall risk posture. Risk Assessment Foundations: Details on conducting IT and business risk assessments, including methodologies, frequency, and integration into strategic planning. Cross-Functional Coordination: Examples of coordination across different organizational functions to manage risks comprehensively and effectively./Risk management is integrated with critical functions such as disaster recovery, incident management, and audit. The foundation for risk management stems from detailed IT and business risk assessments, ensuring a comprehensive approach to identifying and managing risks./","Integration with Critical Functions: How cybersecurity risk management is integrated with disaster recovery, incident management, and other critical functions to enhance overall risk posture. Risk Assessment Foundations: Details on conducting IT and business risk assessments, including methodologies, frequency, and integration into strategic planning. Cross-Functional Coordination: Examples of coordination across different organizational functions to manage risks comprehensively and effectively./Risk management is integrated with critical functions such as disaster recovery, incident management, and audit. The foundation for risk management stems from detailed IT and business risk assessments, ensuring a comprehensive approach to identifying and managing risks./"
Security,Authentication,"The connection management server needs to be connected through a springboard, which has mfa to enhance connection authorization security. If you need to connect to the company mailbox to receive mail at home, you need to use the 6-digit random verification code provided by tp. After successful authentication, you can log in.","Multi-factor Authentication (MFA) Use: Implementation details of MFA, including technologies used, user adoption, and impact on security posture. API Protection in Authentication Strategy: Methods for securing APIs, including authentication mechanisms and protection strategies. Modernization in Authentication Practices: Examples of modernization efforts, such as the use of biometrics, token-based authentication, and user experience improvements./The organization leverages multi-factor authentication and supports API protection, contributing to the modernization of applications and services. This enhances security by implementing stronger authentication mechanisms and securing API access./","Multi-factor Authentication (MFA) Use: Implementation details of MFA, including technologies used, user adoption, and impact on security posture. API Protection in Authentication Strategy: Methods for securing APIs, including authentication mechanisms and protection strategies. Modernization in Authentication Practices: Examples of modernization efforts, such as the use of biometrics, token-based authentication, and user experience improvements./The organization leverages multi-factor authentication and supports API protection, contributing to the modernization of applications and services. This enhances security by implementing stronger authentication mechanisms and securing API access./"
Security,Authorization,Use racf or database unauthorized use detection,"Real-time Insights for Policy Management: How real-time data is used to adjust and manage authorization policies dynamically. Integration with Privilege Management: The connection between authorization systems and privilege management, enhancing access risk management. Adaptiveness of Authorization Policies: Instances where authorization policies were adjusted in response to new security challenges or organizational requirements./Real-time insights are used to manage authorization policy effectively. Integration with privilege management and risk analysis enables the organization to manage risk effectively in the authorization process./","Real-time Insights for Policy Management: How real-time data is used to adjust and manage authorization policies dynamically. Integration with Privilege Management: The connection between authorization systems and privilege management, enhancing access risk management. Adaptiveness of Authorization Policies: Instances where authorization policies were adjusted in response to new security challenges or organizational requirements./Real-time insights are used to manage authorization policy effectively. Integration with privilege management and risk analysis enables the organization to manage risk effectively in the authorization process./"
Security,Privileged Access Mgmt.,Strengthen identity verification application must be made to the supervisor to obtain appropriate authority to avoid the manager from obtaining excessive authority.,Key Controls Implementation: The effectiveness of controls like MFA and Zero Trust in enhancing PAM security. Management of External Privileged Roles: Strategies for securely managing privileged access for customers and partners. SIEM Integration: Benefits of integrating PAM systems with SIEM solutions for enhanced monitoring and incident response./Privilege management is implemented at scale with key controls like Multi-Factor Authentication and integration with a Zero Trust approach. This comprehensive PAM strategy ensures secure and controlled access to critical systems and data./,Key Controls Implementation: The effectiveness of controls like MFA and Zero Trust in enhancing PAM security. Management of External Privileged Roles: Strategies for securely managing privileged access for customers and partners. SIEM Integration: Benefits of integrating PAM systems with SIEM solutions for enhanced monitoring and incident response./Privilege management is implemented at scale with key controls like Multi-Factor Authentication and integration with a Zero Trust approach. This comprehensive PAM strategy ensures secure and controlled access to critical systems and data./
Security,Network Security,"The website that provides customer service has anti-ddos equipment at the front, followed by firewall waf and ips equipment.","Defense-in-Depth Strategy: The composition and efficacy of a multi-layered defense strategy in protecting network resources. Policy and Practice Updates: Processes for regularly updating network security measures in response to evolving threats. Proactive and Continuous Monitoring: Examples of how continuous monitoring aids in the early detection and mitigation of network security incidents./The organization implements a defense-in-depth strategy for network security, ensuring multiple layers of security controls are in place to protect the network infrastructure./","Defense-in-Depth Strategy: The composition and efficacy of a multi-layered defense strategy in protecting network resources. Policy and Practice Updates: Processes for regularly updating network security measures in response to evolving threats. Proactive and Continuous Monitoring: Examples of how continuous monitoring aids in the early detection and mitigation of network security incidents./The organization implements a defense-in-depth strategy for network security, ensuring multiple layers of security controls are in place to protect the network infrastructure./"
Security,Patch Mgmt.,Windows updates are automatically distributed to save manpower. Windows update automatically distributes versions,"Automation in Patch Management: The role of automation in streamlining the patch management process and ensuring timely updates. CI/CD Integration: How patch management is integrated with CI/CD practices to maintain software integrity and security. Regular and Timely Patching: Strategies for ensuring critical systems and applications are promptly updated, prioritizing patches based on risk assessments./Automation is leveraged to scale the patch management process and achieve integration with CI/CD methods & techniques. This approach ensures timely and efficient patching of software vulnerabilities./","Automation in Patch Management: The role of automation in streamlining the patch management process and ensuring timely updates. CI/CD Integration: How patch management is integrated with CI/CD practices to maintain software integrity and security. Regular and Timely Patching: Strategies for ensuring critical systems and applications are promptly updated, prioritizing patches based on risk assessments./Automation is leveraged to scale the patch management process and achieve integration with CI/CD methods & techniques. This approach ensures timely and efficient patching of software vulnerabilities./"
Security,Server/Endpoint Security,"Windows servers terminals are equipped with anti-virus software and edr, which are managed centrally regularly review firewall policies, quarterly network vulnerability scans, and security updates. Regularly review firewall policies, quarterly network vulnerability scanning and security updates","Formalization of Security Program: Components and management of a server/endpoint security program, highlighting key security controls and monitoring practices. Comprehensive Coverage and Monitoring: Strategies to ensure all endpoints are secured and continuously monitored for threats. Compliance Focus: Measures to ensure server/endpoint security practices comply with relevant standards and regulations, including audit and assessment processes./The organization formalizes the server/endpoint security program, actively maintaining inventory and continuously monitoring all endpoints. Emphasis is placed on compliance to ensure robust endpoint protection./","Formalization of Security Program: Components and management of a server/endpoint security program, highlighting key security controls and monitoring practices. Comprehensive Coverage and Monitoring: Strategies to ensure all endpoints are secured and continuously monitored for threats. Compliance Focus: Measures to ensure server/endpoint security practices comply with relevant standards and regulations, including audit and assessment processes./The organization formalizes the server/endpoint security program, actively maintaining inventory and continuously monitoring all endpoints. Emphasis is placed on compliance to ensure robust endpoint protection./"
Security,Access Control,"Usb port-in and port-out data control usb port-in and port-out are controlled the operating environment and the test environment are physically separated on-information security planning department business. Our bank has physical authority control (office buildings, information rooms, etc. Are all equipped with access control and authority control)","Comprehensive Physical Security Access Controls: The range of access control measures deployed to secure facilities and the integration of technology, procedures, and personnel in access control systems. System Integration: The benefits of integrating access control systems with other security systems for enhanced management and incident response. Continuous Monitoring and Auditing: Processes for the ongoing monitoring and auditing of access control effectiveness, contributing to security improvements and adjustments./Comprehensive physical security access controls are deployed, ensuring secure and controlled access to physical facilities and resources./","Comprehensive Physical Security Access Controls: The range of access control measures deployed to secure facilities and the integration of technology, procedures, and personnel in access control systems. System Integration: The benefits of integrating access control systems with other security systems for enhanced management and incident response. Continuous Monitoring and Auditing: Processes for the ongoing monitoring and auditing of access control effectiveness, contributing to security improvements and adjustments./Comprehensive physical security access controls are deployed, ensuring secure and controlled access to physical facilities and resources./"
Security,Facility Mgmt.,"24-hour security, computer room access control, etc. The computer room has 24-hour access control have fire drills we have imported iso27001 and iso20000non-information security planning department business. Our bank has physical authority control (office buildings, information rooms, etc. Are all equipped with access control and authority control)","Comprehensive Controls for Facility Security: The implementation of controls to ensure the security of facilities, including the protection of information, assets, and personnel. Emergency Response Planning: The structure and execution of emergency response plans specific to facilities, highlighting testing and update processes. Security Measures Including Environmental Controls: The role of environmental controls and surveillance systems in maintaining facility security and safety./Comprehensive controls are deployed for physical security facility management, safeguarding information, assets, physical property, and the workforce./","Comprehensive Controls for Facility Security: The implementation of controls to ensure the security of facilities, including the protection of information, assets, and personnel. Emergency Response Planning: The structure and execution of emergency response plans specific to facilities, highlighting testing and update processes. Security Measures Including Environmental Controls: The role of environmental controls and surveillance systems in maintaining facility security and safety./Comprehensive controls are deployed for physical security facility management, safeguarding information, assets, physical property, and the workforce./"
Security,Physical Security Policies & Standards,"In terms of information security governance, an information security policy outline and information security management standards have been formulated. The bank has obtained iso27001 certification and regularly communicates internally and externally on information security issues through the information security committee. Physical security has key points related to physical and environmental security management","Enterprise-scale Physical Security Policies: The development and enforcement of physical security policies and standards across the organization, covering a broad range of scenarios and threats. Regular Review and Update Process: The frequency and triggers for reviewing and updating physical security policies and standards, ensuring relevance and effectiveness. Coverage of Scenarios and Threats: Specific scenarios and threats addressed by physical security policies, guiding organizational security measures and responses./The organization establishes enterprise-scale physical security policies and standards, creating a robust framework that guides the protection of physical assets and resources./","Enterprise-scale Physical Security Policies: The development and enforcement of physical security policies and standards across the organization, covering a broad range of scenarios and threats. Regular Review and Update Process: The frequency and triggers for reviewing and updating physical security policies and standards, ensuring relevance and effectiveness. Coverage of Scenarios and Threats: Specific scenarios and threats addressed by physical security policies, guiding organizational security measures and responses./The organization establishes enterprise-scale physical security policies and standards, creating a robust framework that guides the protection of physical assets and resources./"
Security,Physical Security Risk Management,"The bank performs a cybersecurity information governance maturity assessment. This maturity assessment method adopts the methodology of office cat. In addition, the bank also performs an iso27001 risk assessment and adopts the iso27001 risk assessment methodology (information asset and legal compliance internal external issues assessment).","Comprehensive Controls for Risk Management: The structure and methodologies used for physical security risk management, including risk assessment and mitigation strategies. Integration with Organizational Risk Management: The benefits of integrating physical security risks into the broader organizational risk management framework, enhancing overall risk management effectiveness. Regular Drills and Simulations: Insights gained from regular drills and simulations testing physical security risk responses, influencing security strategies and preparedness./Comprehensive physical security risk management controls are implemented, ensuring a strategic approach to identifying and mitigating physical security threats./","Comprehensive Controls for Risk Management: The structure and methodologies used for physical security risk management, including risk assessment and mitigation strategies. Integration with Organizational Risk Management: The benefits of integrating physical security risks into the broader organizational risk management framework, enhancing overall risk management effectiveness. Regular Drills and Simulations: Insights gained from regular drills and simulations testing physical security risk responses, influencing security strategies and preparedness./Comprehensive physical security risk management controls are implemented, ensuring a strategic approach to identifying and mitigating physical security threats./"
Security,Disaster Recovery,Remote backup is automatically switched and the system operates normally in a very short time.,"Automation in Disaster Recovery Coordination: The impact of automation on disaster recovery efficiency and effectiveness, including specific tools and processes used. Shared Responsibility Model: The structure and benefits of a shared responsibility model in disaster recovery planning, emphasizing collaboration and accountability. Integration with Business Continuity: The coherence between disaster recovery methods and the overall business continuity plan, ensuring a unified approach to organizational resilience./The organization leverages automation and a shared responsibility model to coordinate disaster recovery activities and methods, enhancing resilience and response capabilities./","Automation in Disaster Recovery Coordination: The impact of automation on disaster recovery efficiency and effectiveness, including specific tools and processes used. Shared Responsibility Model: The structure and benefits of a shared responsibility model in disaster recovery planning, emphasizing collaboration and accountability. Integration with Business Continuity: The coherence between disaster recovery methods and the overall business continuity plan, ensuring a unified approach to organizational resilience./The organization leverages automation and a shared responsibility model to coordinate disaster recovery activities and methods, enhancing resilience and response capabilities./"
Security,"Logging, Monitoring, and Alerting",Purchase monitoring software and continue monitoring to ensure that problems can be detected in time and responded quickly to reduce risks and minimize damage. The computer room operates 24 hours a day and has monitoring software automation equipment. The computer room has automated monitoring software equipment,"Continuous Monitoring for Operational Continuity: The contribution of 24x7 real-time monitoring to incident detection and organizational resilience, including specific monitoring strategies and technologies. Automated Response Mechanisms: The role of automation in enhancing incident response times and security operation efficiencies, detailing specific automated response actions. Log and Alert Consolidation: Management and analysis strategies for logs and alerts across mission-critical systems, ensuring effective and timely security incident responses./Operational continuity is enriched through 24x7 and real-time monitoring and insights. Automated responses to alert conditions improve resolution turnaround time and efficiencies./","Continuous Monitoring for Operational Continuity: The contribution of 24x7 real-time monitoring to incident detection and organizational resilience, including specific monitoring strategies and technologies. Automated Response Mechanisms: The role of automation in enhancing incident response times and security operation efficiencies, detailing specific automated response actions. Log and Alert Consolidation: Management and analysis strategies for logs and alerts across mission-critical systems, ensuring effective and timely security incident responses./Operational continuity is enriched through 24x7 and real-time monitoring and insights. Automated responses to alert conditions improve resolution turnaround time and efficiencies./"
