Domain,Capability,Assessment,Criteria1,Criteria2
DevOps,Automation Framework,Tfs automatic deployment use dms to query atm status in Taiwan check whether the documents are complete through the system,"Standardized Toolset: Listen for ""comprehensive toolset,"" ""organization-wide standards,"" and ""unified processes.""Tooling for Development and Deployment: Keywords like ""integrated tooling,"" ""support for application development,"" and ""deployment tool standardization"" are crucial.Infrastructure Templates: Terms such as ""standardized templates,"" ""consistent deployment,"" and ""infrastructure efficiency"" indicate a mature approach./The organization has a standardized set of tools and processes to cover all infrastructure needs. Decisions on tooling to support application development and deployment are made, and standardized infrastructure templates are developed and in use. This le/","Standardized Toolset: Listen for ""comprehensive toolset,"" ""organization-wide standards,"" and ""unified processes.""Tooling for Development and Deployment: Keywords like ""integrated tooling,"" ""support for application development,"" and ""deployment tool standardization"" are crucial.Infrastructure Templates: Terms such as ""standardized templates,"" ""consistent deployment,"" and ""infrastructure efficiency"" indicate a mature approach./The organization has a standardized set of tools and processes to cover all infrastructure needs. Decisions on tooling to support application development and deployment are made, and standardized infrastructure templates are developed and in use. This le/"
DevOps,CI/CD DevOps,Save time and avoid human error,Shared Repository Impact: Enhancements to CI/CD practices through centralization.Automation Impact: Efficiency and reliability benefits from automated builds and testing.Consistency Across Teams: Management of CI/CD uniformity. /The organization has a shared repository of CI/CD tools used by all relevant teams. Most teams use automated builds and some form of scripting for testing and deployment. CI/CD tools and practices are consistent between teams./,Shared Repository Impact: Enhancements to CI/CD practices through centralization.Automation Impact: Efficiency and reliability benefits from automated builds and testing.Consistency Across Teams: Management of CI/CD uniformity. /The organization has a shared repository of CI/CD tools used by all relevant teams. Most teams use automated builds and some form of scripting for testing and deployment. CI/CD tools and practices are consistent between teams./
DevOps,Cont. Compliance Automation,"If the risk is medium or high, we must modify the code and rescan until low risk appears. Corrections or clarifications must be completed within the prescribed time limit cooperate with the compliance department of safety and security to scan for weaknesses and handle reports","Automated Compliance Impact: Improvement in compliance posture.Scripted Remediations: Effectiveness of scripted compliance actions.Unified System for Audits: Contribution to compliance and operational efficiency. /Automated Visibility and reporting: Automated compliance scanning and reporting for all environments. Some remediation's scripted, but triggered manually./","Automated Compliance Impact: Improvement in compliance posture.Scripted Remediations: Effectiveness of scripted compliance actions.Unified System for Audits: Contribution to compliance and operational efficiency. /Automated Visibility and reporting: Automated compliance scanning and reporting for all environments. Some remediation's scripted, but triggered manually./"
DevOps,Test Automation (Shift Left),Tfs automated deployment tool,Standardized Automated Testing: Ensuring testing effectiveness and coverage.Defined Process for Automation: Communication and enforcement of testing processes.Improvement as Objective: Approach to test automation continuous improvement./Standardized Automated testing design and implementation for infrastructure deployments. All teams follow a defined process of using some form of test Automation and improvement of the capabilities is a business priority and valuable to the organization./,Standardized Automated Testing: Ensuring testing effectiveness and coverage.Defined Process for Automation: Communication and enforcement of testing processes.Improvement as Objective: Approach to test automation continuous improvement./Standardized Automated testing design and implementation for infrastructure deployments. All teams follow a defined process of using some form of test Automation and improvement of the capabilities is a business priority and valuable to the organization./
DevOps,Communication/ Collaboration,Developing an in-line rpa process may involve:1. The information department team that maintains and manages the business system2. The team responsible for maintaining and operating the rra system and the team that develops the rpa process3. Business management unit4. Business process analysis unit only through cross-team collaboration and the establishment of a complete division of labor mechanism can the rpa process be successfully introduced.,Standardized Collaboration: Outcomes from standardized cross-team methods.Documentation Accessibility: Speeding up onboarding with well-documented practices.Initiatives for Communication: Project outcomes or team dynamics improvements. /defined: Development and operations teams have a standardized and documented method for cross team collaboration and learning. /,Standardized Collaboration: Outcomes from standardized cross-team methods.Documentation Accessibility: Speeding up onboarding with well-documented practices.Initiatives for Communication: Project outcomes or team dynamics improvements. /defined: Development and operations teams have a standardized and documented method for cross team collaboration and learning. /
DevOps,DevOps-Specific Skill Development,Being on the same team improves an organization's ability to quickly deliver applications and services.,"Process for Skill Gaps: Upskilling team benefits.Talent Development Plans: Catering to comprehensive skill requirements.Centralized Repository Use: Skill development enhancement. /Defined: Organization defines skill gap analysis process and requires all teams to keep an up-to-date plan for filling identified gaps via talent development plans. Leadership builds processes to remove barriers preventing cross-functional teams, begins to track basic metrics/KPIs associated with effectiveness of education and upskilling program, has robust education and upskilling programs that all employees are required to take some level of, and has a robust centralized repository to store DevOps skill-related education/data./","Process for Skill Gaps: Upskilling team benefits.Talent Development Plans: Catering to comprehensive skill requirements.Centralized Repository Use: Skill development enhancement. /Defined: Organization defines skill gap analysis process and requires all teams to keep an up-to-date plan for filling identified gaps via talent development plans. Leadership builds processes to remove barriers preventing cross-functional teams, begins to track basic metrics/KPIs associated with effectiveness of education and upskilling program, has robust education and upskilling programs that all employees are required to take some level of, and has a robust centralized repository to store DevOps skill-related education/data./"
DevOps,Organizational Values / Vison,Continuous improvement through pdca improve the frequency and speed of version releases adjust development strategies with reference to guidelines issued by competent authorities,"Defined and Communicated Values: Reflection in operations and decision-making.Incentivization for Collaboration: Impact on team dynamics and productivity.Strategy Implementation: Measuring success and impact. /The organization values continuous improvement, and it is a priority. The level of engagement and resource investment in the activity is evident.Company strategy dictates that all relevant employees have goals and incentivized to collaborate and improve common standards, automation, and shared DevOps practices. This strategy has just been defined and is currently being proven and potentially rolled out companywide./","Defined and Communicated Values: Reflection in operations and decision-making.Incentivization for Collaboration: Impact on team dynamics and productivity.Strategy Implementation: Measuring success and impact. /The organization values continuous improvement, and it is a priority. The level of engagement and resource investment in the activity is evident.Company strategy dictates that all relevant employees have goals and incentivized to collaborate and improve common standards, automation, and shared DevOps practices. This strategy has just been defined and is currently being proven and potentially rolled out companywide./"
DevOps,Automation Standards,"Through collaboration with consultants in the early stage, we learned which processes are suitable for automation; during the initial confirmation and introduction of the mechanism, relevant specifications will be formulated to comply with internal and external regulations; when the mechanism is mature, the previously established specifications will be adjusted to fit the overall automation framework.tfs creates scripts to complete automated deployment","Guided Automation Adoption: Listen for ""established processes,"" ""in line with framework,"" and ""organization-wide procedures.""Developed Standards: Terms like ""governance standards,"" ""automation policies,"" and ""company-wide guidelines"" are significant.Cohesive Automation Approach: Look for ""consistency across teams,"" ""unified practices,"" and ""organizational alignment.""/Established processes/procedures guide automation adoption in line with the Automation Framework. Standards developed to govern automation approach and develop tooling boundaries. /","Guided Automation Adoption: Listen for ""established processes,"" ""in line with framework,"" and ""organization-wide procedures.""Developed Standards: Terms like ""governance standards,"" ""automation policies,"" and ""company-wide guidelines"" are significant.Cohesive Automation Approach: Look for ""consistency across teams,"" ""unified practices,"" and ""organizational alignment.""/Established processes/procedures guide automation adoption in line with the Automation Framework. Standards developed to govern automation approach and develop tooling boundaries. /"
DevOps,"Design, Strategy, and Standards",Defining clear rules under the information security and information communication specifications for developers to follow will help provide information security-related protection during the application development process and reduce the occurrence of information security incidents.,Organization-wide Standards: Contribution to development efficiency.Adherence in New Developments: Example of project adherence to standards. /Standards for application design and consumption of PaaS resources leveraging cloud best practices are well defined and in use organization wide. All new application development follows these standards regardless of desired hosting location./,Organization-wide Standards: Contribution to development efficiency.Adherence in New Developments: Example of project adherence to standards. /Standards for application design and consumption of PaaS resources leveraging cloud best practices are well defined and in use organization wide. All new application development follows these standards regardless of desired hosting location./
DevOps,"Visibility, Metrics and Goals","Self-checkiso20000, iso27001use plan-do-study continuously improve regular audits",Governance and Monitoring Coverage: Transparency and accountability enhancements.Workflow Understanding: Contributions to product and feature development. /All business units are covered by basic governance and monitoring mechanisms. /,Governance and Monitoring Coverage: Transparency and accountability enhancements.Workflow Understanding: Contributions to product and feature development. /All business units are covered by basic governance and monitoring mechanisms. /
Security,API Security,Transmission encryption use https and source ip control all connections have credentials and encryption mechanisms the connection is encrypted and both parties are authenticated! The connection has an encryption mechanism and both parties have an authentication mechanism. Transmission encrypted channel access requires authentication,"Techniques for Data Protection: Listen for specific methods such as encryption, tokenization, API gateways, rate limiting, and access controls. Quality of Service Improvement: Metrics like latency, throughput, error rates, and user feedback mechanisms should be mentioned. Security Measures Implementation: Details about authentication, authorization, input validation, and regular security assessments are key./The organization develops techniques to protect data and improve the quality of service in API management. This involves implementing security measures to safeguard APIs against attacks and ensuring the APIs maintain high service quality and data protection standards./","Techniques for Data Protection: Listen for specific methods such as encryption, tokenization, API gateways, rate limiting, and access controls. Quality of Service Improvement: Metrics like latency, throughput, error rates, and user feedback mechanisms should be mentioned. Security Measures Implementation: Details about authentication, authorization, input validation, and regular security assessments are key./The organization develops techniques to protect data and improve the quality of service in API management. This involves implementing security measures to safeguard APIs against attacks and ensuring the APIs maintain high service quality and data protection standards./"
Security,Test & Certify,"Perform network vulnerability scanning and penetration testing before the system is officially launched, a weak network scan must be performed. If there are ports that should not appear, the firewall settings need to be adjusted. Inspection personnel before new systems and functions go online, the information security department will perform weak scans on the network and program codes, and conduct penetration tests regularly. Will conduct regular penetration testing and network vulnerability scanning when new systems go online, they will undergo penetration testing and regular penetration testing. There are network vulnerability scans and program code vulnerability scans before going online.","Cybersecurity Integration in Testing: Role of cybersecurity in the testing phases, including vulnerability assessment, security testing tools, and involvement in the SDLC. Focus on Vulnerabilities and Certification: The balance between identifying vulnerabilities and meeting cybersecurity standards, including certification processes like ISO 27001 or NIST compliance. Feedback Loop from Testing to Development: Mechanisms for incorporating test findings into development and security enhancements, indicating a continuous improvement cycle./Cybersecurity is involved in comprehensive activities associated with testing and certifying applications and services. At this level, the focus is not only on identifying vulnerabilities but also on ensuring that applications meet established cybersecurity requirements and control standards through a thorough testing and certification process./","Cybersecurity Integration in Testing: Role of cybersecurity in the testing phases, including vulnerability assessment, security testing tools, and involvement in the SDLC. Focus on Vulnerabilities and Certification: The balance between identifying vulnerabilities and meeting cybersecurity standards, including certification processes like ISO 27001 or NIST compliance. Feedback Loop from Testing to Development: Mechanisms for incorporating test findings into development and security enhancements, indicating a continuous improvement cycle./Cybersecurity is involved in comprehensive activities associated with testing and certifying applications and services. At this level, the focus is not only on identifying vulnerabilities but also on ensuring that applications meet established cybersecurity requirements and control standards through a thorough testing and certification process./"
Security,Cryptographic Services,Regularly update credentials and improve encryption protocols update credentials regularly vouchers will be updated regularly when they expire update credentials regularly,"Lifecycle Management Practices: Processes for key generation, distribution, rotation, and retirement, emphasizing automation and compliance with standards like NIST. As-a-Service Offering: Benefits of cryptographic services offered as-a-service, such as scalability, ease of use, and compliance facilitation. Scope of Lifecycle Management: The extent of lifecycle management coverage, including hardware security modules (HSMs), cloud-based key management, and policy enforcement mechanisms./Cybersecurity provides comprehensive lifecycle management of cryptographic services, including as-a-service offerings. This involves overseeing the entire lifecycle of cryptographic elements, from creation and deployment to retirement, ensuring secure and efficient cryptographic operations./","Lifecycle Management Practices: Processes for key generation, distribution, rotation, and retirement, emphasizing automation and compliance with standards like NIST. As-a-Service Offering: Benefits of cryptographic services offered as-a-service, such as scalability, ease of use, and compliance facilitation. Scope of Lifecycle Management: The extent of lifecycle management coverage, including hardware security modules (HSMs), cloud-based key management, and policy enforcement mechanisms./Cybersecurity provides comprehensive lifecycle management of cryptographic services, including as-a-service offerings. This involves overseeing the entire lifecycle of cryptographic elements, from creation and deployment to retirement, ensuring secure and efficient cryptographic operations./"
Security,Data Protection,"There is a dlp mechanism for links to external web pages and outgoing emails, and usb has anti-write control. Handled in accordance with relevant regulations sensitive data access rights control. Information cannot be taken out at will, and must be released by the supervisor. Social engineering drills will be conducted from time to time. Phishing letters, the content of letters cannot contain personal information, hard drive data cannot be taken out, and social engineering drills letter cannot contain personal information, and personal information cannot be exported. Occasional social engineering exercises. Websense  export ","Enterprise-scale Controls Implementation: Strategies for applying data protection controls across various data environments, including cloud, on-premise, and hybrid models. Edge Computing Data Protection: Techniques and technologies used to secure data at the edge, such as encryption, secure access, and network segmentation. Consistency Across Areas: Ensuring uniform data protection standards and practices are applied consistently, regardless of the computing environment or location./The organization applies data protection controls at an enterprise scale and extends these capabilities to edge computing environments. This approach ensures that critical data is safeguarded effectively across all organizational operations, including those at the network edge./","Enterprise-scale Controls Implementation: Strategies for applying data protection controls across various data environments, including cloud, on-premise, and hybrid models. Edge Computing Data Protection: Techniques and technologies used to secure data at the edge, such as encryption, secure access, and network segmentation. Consistency Across Areas: Ensuring uniform data protection standards and practices are applied consistently, regardless of the computing environment or location./The organization applies data protection controls at an enterprise scale and extends these capabilities to edge computing environments. This approach ensures that critical data is safeguarded effectively across all organizational operations, including those at the network edge./"
Security,Business Continuity,"Db install Imperva or gardium regularly conduct same-site and off-site backup drills, and cooperate with the security department to handle iso 22301 verification establish local and remote backup drills and introduce is22301import iso22301there are co-location backup and remote backup established","Scheduled Exercises: The planning, execution, and key outcomes of business continuity exercises, with a focus on identifying and addressing gaps. Feedback Loop: Mechanisms for collecting and integrating feedback from exercises into continuous improvement of business continuity plans. Critical Integrations: How business continuity planning integrates with related functions like crisis management and disaster recovery to enhance readiness and response./The organization develops and sustains continuity readiness by leveraging scheduled exercises and a comprehensive feedback loop. Integration with critical functions like crisis management, disaster recovery, incident response, and GRC strengthens the overall business continuity posture./","Scheduled Exercises: The planning, execution, and key outcomes of business continuity exercises, with a focus on identifying and addressing gaps. Feedback Loop: Mechanisms for collecting and integrating feedback from exercises into continuous improvement of business continuity plans. Critical Integrations: How business continuity planning integrates with related functions like crisis management and disaster recovery to enhance readiness and response./The organization develops and sustains continuity readiness by leveraging scheduled exercises and a comprehensive feedback loop. Integration with critical functions like crisis management, disaster recovery, incident response, and GRC strengthens the overall business continuity posture./"
Security,Cybersecurity Strategy,"The bank has certified the iso27001 international standard, complies with the iso 27001 information security control field, formulates, and implements information security-related control objectives and measures, and meets the information security requirements required by the bank. We also implement relevant information security governance and compliance in compliance with the information security regulations of the competent authorities, and conduct annual computer system information security assessments and overall information security implementation assessments. ""","Strategy Governance: The comprehensive approach to governance, including policy development, risk management, and stakeholder engagement. Communication Tools: Use of dashboards and reports to provide transparency on the cybersecurity strategy's status and engage with stakeholders effectively. Hybrid-/Multi-Cloud Environment Consideration: Adaptations and considerations in the cybersecurity strategy to address the complexities of managing security across hybrid and multi-cloud IT environments./A comprehensive approach to strategy governance incorporates a shared responsibility model across firstand third-parties. The strategy encompasses a hybrid-/multi-cloud IT environment and places emphasis on continuous compliance, with status and results communicated to stakeholders through dashboards and reports./","Strategy Governance: The comprehensive approach to governance, including policy development, risk management, and stakeholder engagement. Communication Tools: Use of dashboards and reports to provide transparency on the cybersecurity strategy's status and engage with stakeholders effectively. Hybrid-/Multi-Cloud Environment Consideration: Adaptations and considerations in the cybersecurity strategy to address the complexities of managing security across hybrid and multi-cloud IT environments./A comprehensive approach to strategy governance incorporates a shared responsibility model across firstand third-parties. The strategy encompasses a hybrid-/multi-cloud IT environment and places emphasis on continuous compliance, with status and results communicated to stakeholders through dashboards and reports./"
