Domain,Capability,Assessment,Criteria1,Criteria2
Applications,Operating Model,Let professionals do specialized work,"Distributed Team Benefits: Enhancements in product focus and organizational efficiency due to cross-functional teams.TBO's Role: The influence of TBO on team structures and effectiveness. /Fosters ""distributed"" cross-functional teams with a focus on customer-centric principles, leveraging external partnerships and cloud strategies to streamline operations and service delivery./","Distributed Team Benefits: Enhancements in product focus and organizational efficiency due to cross-functional teams.TBO's Role: The influence of TBO on team structures and effectiveness. /Fosters ""distributed"" cross-functional teams with a focus on customer-centric principles, leveraging external partnerships and cloud strategies to streamline operations and service delivery./"
Applications,Modern Coding Practices,"At present, the bank is developing a middle platform design method. Systems in specific fields are required to use specified technical standards for design and development. This method allows it personnel to be more focused and familiar with the corresponding technical standards and methods. Contribute to project development and maintenance operations. Developers work together to follow the same coding standards to avoid information gaps causing difficulties during business handover.","Automated Testing and Strategy Impact: Effects on software quality and reliability.Influence of Coding Standards: How adherence to standards has shaped development practices and outcomes. /Advocates for a comprehensive development framework, incorporating automated testing, agile methodologies, coding standards, and frequent code reviews for quality assurance./","Automated Testing and Strategy Impact: Effects on software quality and reliability.Influence of Coding Standards: How adherence to standards has shaped development practices and outcomes. /Advocates for a comprehensive development framework, incorporating automated testing, agile methodologies, coding standards, and frequent code reviews for quality assurance./"
Applications,Release Management,"This part is currently a semi-automated process in our bank. There are manual procedures for program entry, testing, inspection, qa and other operations. However, most of the online operations have been automated through tfs tools. The most important benefit should be to reduce this some human impact risks. Reduce manual work errors and improve printing efficiency","Automated Program Use: The improvement in deployment speed and reliability due to automation.Benefits of High Automation Rate: Observed advantages from automating the majority of software releases. /Enables automated and streamlined release management processes, with a focus on increasing deployment automation and reducing release frequencies for optimized delivery./","Automated Program Use: The improvement in deployment speed and reliability due to automation.Benefits of High Automation Rate: Observed advantages from automating the majority of software releases. /Enables automated and streamlined release management processes, with a focus on increasing deployment automation and reducing release frequencies for optimized delivery./"
Innovation,CSP Newest Capabilities (Cloud Technologies),"Working with hpe consultants by cooperating with hpe, consultants will help organizations introduce cloud technology; learn about peers' cloud progress through news media, and then learn and find relevant information on their own. Participate in relevant education and training view related articles seminars and related courses attended work with consultants and receive training from learning institutions","Active Integration: Management of new cloud technology integration.Discovery and Learning Process: Approach to incorporating new technologies. /The organization proactively leverages the latest cloud technologies, guided by robust learning and discovery programs, with metrics to track the successful integration of new cloud features./","Active Integration: Management of new cloud technology integration.Discovery and Learning Process: Approach to incorporating new technologies. /The organization proactively leverages the latest cloud technologies, guided by robust learning and discovery programs, with metrics to track the successful integration of new cloud features./"
Innovation,Defined Innovation Vision and Strategy,"Communicate to different departments through consensus camps and chief executive meetings meeting announcements and classes through consensus camps for senior executives and the whole bank, as well as meetings hosted by the head, the core concepts are conveyed to senior executives and colleagues within the bank. Through regular meetings, we will deepen each department understanding of the cloud vision and strategy. Digital development council and its working groups through high-level meetings deliver and promote through meetings through education and training through education and training through education and training communicated from senior management meetings to department heads senior executive support convene a consensus camp for all departments and branches to express our cloud vision","Clearly Defined Strategy: Communication and departmental understanding of innovation strategy.Executive Buy-in: Examples of strategic alignment and execution. /A clearly established innovation vision and strategy exist, fully supported by executive buy-in and understood across various departments, ensuring a unified approach to innovation./","Clearly Defined Strategy: Communication and departmental understanding of innovation strategy.Executive Buy-in: Examples of strategic alignment and execution. /A clearly established innovation vision and strategy exist, fully supported by executive buy-in and understood across various departments, ensuring a unified approach to innovation./"
Innovation,Innovation Feedback Loop,"Through the feedback mechanism, the overall system and functional operation can be closer to reality and comply with regulations. The project regularly tracks the implementation progress. If there is a gap with the implementation target, improvements need to be made immediately; after the project is completed, it is still necessary to collect user feedback, evaluate and optimize system functions to comply with specifications while also making the user experience smoother. Observe what users need and how developers can satisfy users. Rather than what developers can do, it is provided for users to use.in regular meeting increase cross-departmental discussions","Integration of Feedback Loop: Use of insights to improve innovation functions.Daily Operations and Meetings: Examples of feedback loop integration and impact. /A closed feedback loop is integrated into daily operations and meetings, leveraging data insights to continuously refine and improve innovation functions./","Integration of Feedback Loop: Use of insights to improve innovation functions.Daily Operations and Meetings: Examples of feedback loop integration and impact. /A closed feedback loop is integrated into daily operations and meetings, leveraging data insights to continuously refine and improve innovation functions./"
Innovation,Evaluation Program for Start-ups and Incubators,"After formulating the mid- and long-term plans, regularly evaluate whether the current implementation methods need to be adjusted to meet and achieve the mid- and long-term goals. Evaluate the organization's innovative ideas and invite industry executives and professional consultants to participate in discussions to ensure they are in line with the organization's future strategies and standards. With the current joint participation method and participants, it is indeed impossible to fully ensure that the evaluation process can be effectively benchmarked.","Departmental Involvement: Alignment with investment strategies.Evaluation Process: Organizational approach to startup evaluation. /Multiple departments engage in evaluating startups for investment, with a structured investment program and criteria ensuring strategic and profitable selections./","Departmental Involvement: Alignment with investment strategies.Evaluation Process: Organizational approach to startup evaluation. /Multiple departments engage in evaluating startups for investment, with a structured investment program and criteria ensuring strategic and profitable selections./"
Innovation,Employee Innovation Ideas Capture (Discovery),"Internal reward mechanism the work simplification team regularly solicits work simplification plans, and the selected plans will receive bonuses.","Centralized Idea Capture: Management and encouragement of employee ideas.Idea Management Process: Approach to fostering innovation among teams. /A centralized idea capturing tool is in place, encouraging regular idea sharing among localized teams, fostering a culture of innovation and collaboration./","Centralized Idea Capture: Management and encouragement of employee ideas.Idea Management Process: Approach to fostering innovation among teams. /A centralized idea capturing tool is in place, encouraging regular idea sharing among localized teams, fostering a culture of innovation and collaboration./"
Innovation,Evaluate and Incubate Ideas from all Sources,"Invite external experts and internal executives to jointly select first, professional consultants are used to evaluate the technical feasibility, and the business management unit is asked to evaluate the business feasibility, regulatory compliance, and introduction benefits of the proposal. The relevant information is then provided to the executive, who makes the final choice. Provide current practice taking colab as an example, cross-department members may communicate and vote. The final results are then presented to senior managers.","Formalized Evaluation Criteria: Process for idea evaluation and selection.Recurring Evaluation Sessions: Examples of idea selection and incubation. /Formalized criteria for idea evaluation are implemented, with monthly sessions to nurture and select innovative ideas, ensuring a continuous pipeline of creativity./","Formalized Evaluation Criteria: Process for idea evaluation and selection.Recurring Evaluation Sessions: Examples of idea selection and incubation. /Formalized criteria for idea evaluation are implemented, with monthly sessions to nurture and select innovative ideas, ensuring a continuous pipeline of creativity./"
Innovation,Design Thinking and Lean Hypothesis Development Creative Agility,"Invite users to conduct interviews and provide details of the entire process. After development, conduct user testing and adjust non-compliant functions to meet expectations.","Use of Design Thinking: Incorporation of customer empathy in development.Hypothesis Testing Process: Examples of lean hypothesis application in projects. /Customer-facing applications are developed based on deep customer empathy, with rigorous hypothesis testing and metrics to validate outcomes, ensuring products truly meet customer needs./","Use of Design Thinking: Incorporation of customer empathy in development.Hypothesis Testing Process: Examples of lean hypothesis application in projects. /Customer-facing applications are developed based on deep customer empathy, with rigorous hypothesis testing and metrics to validate outcomes, ensuring products truly meet customer needs./"
Innovation,Formalized Organizational Focus,No unified guiding principles regular follow-up reports from the digital development committee regular follow-up reports from the digital development committee regular follow-up reports from the digital development committee seminar,"Designated Innovation Managers: Utilization of principles and roadmaps for innovation.Innovation Management: Examples of achieving innovation objectives. /Multiple managers across the organization are dedicated to innovation, guided by unified principles, visions, and roadmaps to drive operational success./","Designated Innovation Managers: Utilization of principles and roadmaps for innovation.Innovation Management: Examples of achieving innovation objectives. /Multiple managers across the organization are dedicated to innovation, guided by unified principles, visions, and roadmaps to drive operational success./"
Innovation,Innovation is Funded,"Through the internal budget preparation method, budget execution status reports, follow-up procurement project progress reports, and introduction of benefits, etc., it is ensured that the use of funds is in line with the internal planning. Innovative activities supported by the head of government make full use of funds through budget preparation, budget execution status, regular reporting on the implementation progress after the project is launched, and continuous tracking of benefits after completion. The budget is prepared and reviewed every year. After review, it is implemented according to the schedule. The budget is prepared and reviewed every year. After review, it is implemented according to the schedule. The budget is prepared and reviewed every year. After review, it is implemented according to the schedule.","Regular Funding Allocation: Structure and use of funding for innovation.Support for Innovative Activities: Examples of funding impact on innovation. /Innovation receives generous funding across most business units, supporting a wide range of innovative activities and fostering a culture of creativity and experimentation./","Regular Funding Allocation: Structure and use of funding for innovation.Support for Innovative Activities: Examples of funding impact on innovation. /Innovation receives generous funding across most business units, supporting a wide range of innovative activities and fostering a culture of creativity and experimentation./"